name        , type       , strDefault, attributes                     , section  , upgrades, docOrder, description
range       , blkrange   ,           , width=150px|readOnly     , Range    ,         ,        1, the block range (inclusive) covered by this chunk
magic       , string     ,           , width=150px|readOnly|noTable     , Identity ,         ,        2, an internal use only magic number to indicate file format
hash        , hash       ,           , width=150px|readOnly|noTable     , Identity ,         ,        3, the hash of the specification under which this chunk was generated
nAddresses  , uint64     ,           , width=150px|readOnly     , Counts   ,         ,        4, the number of addresses in this chunk
nAppearances, uint64     ,           , width=150px|readOnly     , Counts   ,         ,        5, the number of appearances in this chunk
size        , uint64     ,           , width=150px|readOnly     , Sizes    ,         ,        6, the size of the chunk in bytes
